id	name	address	zip	city_hotel	cc1	ufi	class	currencycode	minrate	maxrate	preferred	nr_rooms	longitude	latitude	public_ranking	hotel_url	photo_url	desc_en	desc_fr	desc_es	desc_de	desc_nl	desc_it	desc_pt	desc_ja	desc_zh	desc_pl	city_unique	city_preferred	continent_id	
17742	Oakdene Guest House	99 Baron van Reede Street	6625	Oudtshoorn	za	-1270304	3.0	ZAR	750	1510		6	22.204281	-33.583062	33778	http://www.booking.com/hotel/za/oakdene-guest-house-oudtshoorn.html	http://aff.bstatic.com/images/hotel/org/112/1123328.jpg	This utterly charming Victorian home, one of the oldest houses in historic Oudtshoorn, has been lovingly restored and declared a National Monument.										oudtshoorn	Oudtshoorn	5	\

171361	Coral International Cape Town	Cnr Buitengracht and Wale Street	8001	Cape Town	za	-1217214	5.0	ZAR	900	12500		137	18.415962	-33.922004	98154	http://www.booking.com/hotel/za/coral-international-cape-town.html	http://aff.bstatic.com/images/hotel/org/196/1969851.jpg	Ideally located at the foot of Table Mountain, this 5-star hotel offers luxurious accommodation, on the border of Bo-Kaap and near V&A Waterfront.								坐落在Table山脚下，在Bo-Kaap边缘并靠近V&A海滨码头广场，这家五星级酒店提供豪华的住宿。  Coral International Cape Town酒店设有装饰精美的客房和套房，房内的设施包括豪华的床单、等离子电视、有线电视、高速有线和无线上网。每间套房还包括一个优雅舒适的起居区，部分还具有Table山或古老的Bo-Kaap区的景色。  酒店的阁楼设有先进的健身和水疗设施，以及2间国际美食餐厅。酒店内不供应酒水，但附近便设有酒吧。 ...		cape-town	Cape Town	5	\

171383	Knysna Stays	25 Old Toll Road	6571	Knysna	za	-1246436	4.0	ZAR	750	1350		7	23.07036	-34.03898	79142	http://www.booking.com/hotel/za/knysna-stays.html	http://aff.bstatic.com/images/hotel/org/215/2158300.jpg	Situated in Knysta town, this new 4-star establishment offers ideal accommodation close to Knysna Lagoon and it's many attractions and outdoor activities.  Knysna Stays offers suites and apartments with modern décor and furnishings.										knysna	Knysna	5	\

15505	Wild Rose Country Lodge	4 Bodrum Close,  Crofters Valley	7985	Noordhoek 	za	-1267194	4.0	ZAR	765	1600		6	18.38327	-34.11023	24584	http://www.booking.com/hotel/za/wild-rose-country-lodge.html	http://aff.bstatic.com/images/hotel/org/966/966307.jpg	Nestled between spectacular mountain scenery and the shores of the Atlantic Ocean, this stylish lodge beckons guests to marvel at unforgettable panoramic views.  Enjoy a glass of sherry upon arrival.										noordhoek	Noordhoek	5	\

15310	Crooked Tree Cottage	39 Hilken Drive	4319	Umhlanga	za	-1294257	3.0	ZAR	470	1200		6	31.0810679197311	-29.7226538559294	41305	http://www.booking.com/hotel/za/crooked-tree-cottage.html	http://aff.bstatic.com/images/hotel/org/154/1547385.jpg	Crooked Tree Cottage offers Bed & Breakfast or self-catering accommodation close to Umhlanga's beaches and a short drive from Durban and its famous Golden Mile.	Le cottage Crooked Tree Cottage propose un hébergement en B&B ou indépendant, à deux pas des plages d'Umhlanga, non loin de Durban et de son célèbre Golden Mile.  Cet établissement intime se compose de trois chambres et de trois appartements.				Il Crooked Tree Cottage offre sistemazioni con trattamento bed & breakfast o alloggi con angolo cottura vicino alle spiagge di Umhlanga e a breve distanza in auto da Durban e dal suo famoso Golden Mile.					umhlanga-rocks	Umhlanga	5	\

17627	18 on Crox Guest House	18 Croxteth Road	8005	Cape Town	za	-1217214	4.0	ZAR	1175	4000		4	18.4048	-33.9091	92293	http://www.booking.com/hotel/za/18-on-crox-guest-house.html	http://aff.bstatic.com/images/hotel/org/130/1306264.jpg	Designed with your comfort in mind, 18 on Crox Guest House is a great base for exploring Cape Town's many attractions.  Start the day with a swim in the pool, followed by breakfast in the courtyard.	La maison d'hôtes 18 on Crox Guest House, qui a été conçue pour vous assurer un niveau maximal de confort, constitue un excellent pied-à-terre pour partir à la découverte des différents sites du Cap.	Este boutique hotel, ubicado a las afueras del centro de Ciudad del Cabo, le seducirá con su encanto exclusivo e íntimo y su elegante lujo.	Das 18 on Crox Guest House legt größten Wert auf Komfort und ist ein idealer Ausgangspunkt zur Entdeckung der vielen Attraktionen Kapstadts.  Beginnen Sie Ihren Tag mit einer Runde im Pool bevor Sie Ihr Frühstück im Hof genießen.	Het 18 on Crox Guest House is ontworpen met uw comfort in gedachten en het vormt een uitstekende uitvalsbasis voor het verkennen van de vele bezienswaardigheden van Kaapstad.				在设计时已将住客的舒适考虑在内，18 on Crox宾馆是游览开普敦众多旅游景点的理想基地。  在游泳池游泳来开始您的一天，接下来在宾馆天井舒适地享受早餐。休息室是您18 on Crox宁静气氛的理想地点。  宾馆客房设计现代，配备豪华的家具。您可以在酒吧阅读报纸，或尽情使用您套房内的私人阳台。  整个酒店区域免费提供无线网络连接。除此之外，入住该酒店客房的客人可以使用个人电脑。		cape-town	Cape Town	5	\

28043	Sea Breeze Inn B&B	21 Capricorn Drive	6600	Plettenberg Bay	za	-1273101	4.0	ZAR	550	1300		3	23.3692181110382	-34.0868488542691	67271	http://www.booking.com/hotel/za/sea-breeze-inn.html	http://aff.bstatic.com/images/hotel/org/135/1352771.jpg	Located in a tranquil area of Plettenberg Bay, just a short stroll from scenic Robberg Beach, this family-run lodge presents guests with an exceptionally comfortable home-away-from-home.				Dit door een familie gerunde pension ligt in een rustig deel van Plettenbergbaai, op korte wandelafstand van het schilderachtige strand van Robberg. Geniet in deze lodge van een comfortabele, huiselijke sfeer.						plettenberg-bay	Plettenberg Bay	5	\

15564	Blackheath Lodge	6 Blackheath Road	8005	Cape Town	za	-1217214	4.0	ZAR	780	2650		10	18.3976793289185	-33.9102079034559	63575	http://www.booking.com/hotel/za/blackheath-lodge.html	http://aff.bstatic.com/images/hotel/org/998/998896.jpg	This is a 2-floor Victorian guest house below Signal Hill, close to the city, Waterfront and well-known beaches.			Das zweistöckige viktorianische Gästehaus liegt unterhalb des Signal Hill, nahe dem Stadtzentrum, dem Hafen und den berühmten Stränden.  Das 1880 erbaute Haus verfügt über großzügige Räume, hohe Decken und Holzböden.			Esta é uma casa de hóspedes vitoriana com 2 pisos abaixo de Signal Hill, próximo da cidade, da costa e de praias conhecidas.		这是一栋两层楼的维多利亚风格旅馆，在Signal Hill山之下，邻近城市、海滨和著名的沙滩。  酒店建于1880年代，设有宽敞的内部环境、高天花板和木地板， 最近经过重新装修，待有独特的非洲风格和魅力。酒店旨在为您提供时髦的客房、优越的个人化服务和温馨招待。  您可在俯瞰着泳池和花园的露台上享用早餐。在忙碌的一天杂外观光或经商之后，回到酒店享用一杯黄昏时分的鸡尾酒，并可享受安静舒适的睡眠。酒店也很乐意为您提供晚餐，或是日间到海滩或登山远足的野餐餐点。		cape-town	Cape Town	5	\

15488	Harbour House Hotel and Guest House	18 Harbour Road	7200	Hermanus	za	-1236784	4.0	ZAR	700	1495		18	19.279461	-34.411158	69466	http://www.booking.com/hotel/za/harbour-house-and-guest-house.html	http://aff.bstatic.com/images/hotel/org/902/902873.jpg	Positioned only a few metres from the water’s edge, at the heart of the Old Harbour, this deluxe 4-star hotel and guest house ensures guests an enjoyable stay.	Situé à quelques mètres du bord de l'eau, au cœur du vieux port, cet hôtel 4 étoiles et guest house vous assure un séjour agréable.	Ubicado a pocos metros del mar, en el corazón del antiguo puerto, este hotel de lujo de 4 estrellas ofrece un alojamiento agradable.								hermanus	Hermanus	5	\

15636	Latreuo Guest House	17 Gloxinia Street  Boston	7530	Bellville 	za	-1210113	4.0	ZAR	750	2400		5	18.6077499389648	-33.8744063107916	49427	http://www.booking.com/hotel/za/latreuo.html	http://aff.bstatic.com/images/hotel/org/100/1005987.jpg	Situated just 20 minutes away from Cape Town, this charming provincial house provides a relaxing and welcoming environment in the leafy suburb of Welgemoed, Belville.	Située à seulement 20 minutes du Cap, cette agréable maison provençale constitue un cadre accueillant et reposant, dans la banlieue verdoyante de Welgemoed, Belville.			Dit charmante provinciale guesthouse ligt op slechts 20 minuten van Kaapstad en biedt een ontspannen en gastvrije omgeving in de groene buitenwijk van Welgemoed in Belville.  Latreuo is afgeleid uit het Grieks, en betekent: 'komt tot leven'.						bellville	Bellville	5	\

15179	Honeyguide Tented Safari Camps	Manyeleti Reserve, Greater Kruger National Park	1380	Manyeleti	za	-1256992	4.0	ZAR	4400	7600		24	31.4276659102301	-24.5482543135128	21116	http://www.booking.com/hotel/za/honeyguide-tented-safari-camps.html	http://aff.bstatic.com/images/hotel/org/676/676110.jpg	Experience a tented safari adventure at a ‘big 5’ reserve in the greater Kruger National Park area, where 2 en suite tented camps offer you the chance to get back to nature.		Viva una inolvidable aventura de safari en esta reserva \"big 5\" (se conocen así las reservas que albergan leones, elefantes africanos, rinocerontes negros y búfalos) en el extenso parque nacional Kruger, donde 2 campamentos de tiendas con baño le...		Beleef een avontuurlijke safari in een 'big 5' reservaat in het grote Kruger Nationaal Park. De 2 tentenkampen met eigen badkamer bieden u de kans om optimaal te genieten van de natuur.	Avventuratevi in un safari alla scoperta dei 5 Big, nel grande parco nazionale di Kruger. dove due campi con tende vi daranno la possibilità di sperimentare la vita a contatto con la  natura.			入住该酒店，您可到广阔的Kruger 国家公园big 5保护区附近体验帐篷游猎冒险的活动，那里提供2个连接式帐篷营地，可让您回到大自然。  这个度假胜地拥有2个连接式帐篷营地，提供全膳服务，包括种类丰富的佳肴、多种饮料和精彩的活动。在这里，您可以坐着敞篷车或在导游的带领下散步欣赏非洲灌木丛和多种野生动物，这些均在专业、有经验的导游和追踪器的监督下。		manyeleti	Manyeleti	5	\

25895	Casta Diva	67 Albatros Street, Ninapark, Akasia	0156	Pretoria	za	-1273769	4.0	ZAR	750	2900		9	28.1459641	-25.6857977	57284	http://www.booking.com/hotel/za/casta-diva.html	http://aff.bstatic.com/images/hotel/org/131/1311322.gif	Casta Diva is an exclusive, luxury boutique hotel surrounded by lush sub-tropical gardens - an oasis of peace and tranquillity just 8 kilometres from the centre of Pretoria.								Casta Diva酒店是一家精致的豪华精品酒店，被葱郁的亚热带花园所包围－这里是和平与安宁的绿洲并且距离Pretoria（比勒陀利亚）市中心仅８公里。  酒店占据美丽的庄园，提供６间客房和套房以及３间设施齐全的自助式公寓。 住宿分布在主楼和两幢别墅，所有客房设有私人入口、独特的个性和特别的花园环境。  在您经过活跃假期之后，酒店周围的乡村适合您远足。 此外，您可以打网球、在健身室工作或是在迷人的游泳池畅泳。  酒店的花园、水景和观鸟则邀请您前来放松。...		pretoria	Pretoria	5	\

15522	Camps Bay Glen	40 Rottingdean Road	8040	Camps Bay 	za	900040022	0.0	ZAR	550	2450		4	18.3753848075867	-33.9645583798079	35167	http://www.booking.com/hotel/za/campsbayglen.html	http://aff.bstatic.com/images/hotel/org/106/1067766.jpg	Situated on the edge of a nature reserve, with a mountain stream running right through its garden, this rustic guest house offers affordable accommodation in a very beautiful country like setting.	Située aux abords d'une réserve naturelle, avec un jardin traversé par un ruisseau de montagne, cette maison d'hôtes rustique propose un hébergement à des prix raisonnables dans un magnifique cadre campagnard.	Ubicado en el centro de la reserva natural, con un arroyo montañoso justo detrás del jardín, este hotel rústico ofrece un alojamiento económico en un precioso entorno rural.		Dit verblijf ligt aan de rand van een natuurreservaat, met een bergriviertje dat dwars door de tuin loopt. In dit rustieke verblijf vindt u betaalbare accommodatie in een prachtige, landelijke omgeving.						camps-bay-za	Camps Bay	5	\

15127	Fountains Hotel	1 St. Georges Mall	8100	Cape Town	za	-1217214	4.0	ZAR	640	1400		160	18.4248661994934	-33.9196456203097	78438	http://www.booking.com/hotel/za/fountains.html	http://aff.bstatic.com/images/hotel/org/641/641044.jpg	Situated in the heart of Cape Towns business district, Fountains Hotel overlooks the famous fountains and offers quality accommodation within walking distance of the city's convention centre and V&A Waterfront.	Situé en plein cœur du quartier des affaires du Cap, le Fountains Hotel surplombe les fameuses fontaines et propose un hébergement de qualité, le tout à distance de marche du centre de conventions et de la promenade V&A Waterfront.	El Fountains Hotel está en el corazón del distrito financiero de Ciudad del Cabo, con vistas a las famosas fuentes. Ofrece habitaciones de calidad a pocos pasos del centro de convenciones y del muelle V&A.	Im Herzen des Geschäftsviertels von Kapstadt bietet Ihnen das Fountains Hotel Blick auf den berühmten Brunnen und eine komfortable Unterkunft nur einen kurzen Spaziergang entfernt vom Kongresszentrum und der V&A Waterfront.	Het Fountains Hotel, gelegen in het hart van de zakenwijk van Cape Town, kijkt uit op de beroemde fonteinen en biedt kwaliteitsaccommodatie op wandelafstand van het conventiecentrum en het V & A Waterfront.	Situato nel cuore del quartiere degli affari di Città del Capo, il Fountains Hotel si affaccia sulle famose fontane e offre sistemazioni di qualità a breve distanza a piedi dal centro convegni e dal V&A Waterfront.	Situado no coração da área de negócios da Cidade do Cabo, o Hotel Fountains tem vista para as famosas fontes e oferece alojamento de qualidade a pouca distância do centro de convenções da cidade e do V & A Waterfront.		Fountains Hotel 坐落在开普敦商业区，俯瞰著名的喷泉，为您提供高品质的住宿，也让您可步行抵达城市里的会议中心和V＆A海滨。  Fountains Hotel酒店设有一流的设施，坐拥便利的地点，是您前来经商或游览景点的最佳出发点。  每一间设备完善的客房都配有空调，还提供沏茶/咖啡设施和优质的过滤咖啡。  客人可以使用设备齐全的健身中心，那里设有室内游泳池和令人放松的桑拿浴室。Fountain Hotel 酒店业让您可欣赏台伯山的美景。 ...	Położony w samym sercu biznesowej dzielnicy Kapsztadu hotel Fountains oferuje wysokiej klasy zakwaterowanie z widokiem na słynne fontanny, w odległości spaceru od centrum kongresowego miasta oraz nabrzeża V&A.	cape-town	Cape Town	5	\

49838	A Lala Lodge	196 Edinburgh Road	0149	Centurion 	za	437330	4.0	ZAR	470	680		10	28.1743693	-25.8327456	65072	http://www.booking.com/hotel/za/a-lala-lodge.html	http://aff.bstatic.com/images/hotel/org/158/1580689.jpg	Easily accessible via motorway, this lodge offers family-friendly accommodation in Centurion, a city in South Africa’s Gauteng Province.  Perfect for guests looking to experience genuine hospitality, A Lala Lodge features 10 comfortable guest rooms.										centurion	Centurion	5	\

171242	Langenhoven B&B	124 Langenhoven Road	6625	Oudtshoorn	za	-1270304	3.0	ZAR	275	840		7	22.2162394	-33.6146858	25217	http://www.booking.com/hotel/za/langenhoven-bb.html	http://aff.bstatic.com/images/hotel/org/174/1745947.jpg	Located in Oudtshoorn, a town at the heart of South Africa's Klein Karoo region, this bed and breakfast provides travellers with a comfortable base.										oudtshoorn	Oudtshoorn	5	\

15375	Quayside Apartments	34 Prestwich Street	8001	Cape Town	za	-1217214	0.0	ZAR	660	3800		17	18.4204512834549	-33.9169301579442	94301	http://www.booking.com/hotel/za/quayside-apts.html	http://aff.bstatic.com/images/hotel/org/965/965353.jpg	Ideally situated near the famous V&A Waterfront, close to the city centre, this luxurious apartment is a truly wonderful location for guests seeking up-market accommodation.	Idéalement situés près du célèbre V&A Waterfront, proches du centre-ville, ces appartements de luxe sont la destination de choix pour qui recherche un hébergement haut de gamme.	Este lujoso complejo de apartamentos, situado cerca del paseo marítimo V&A y del centro de la ciudad, es ideal para aquellos que buscan alojamiento en la ciudad.		Dit luxueuze appartement ligt ideaal nabij het beroemde Victoria & Alfred Waterfront, vlakbij het stadscentrum. Het is een prachtlocatie voor wie op zoek is naar de betere accommodatie.	Questo hotel si trova vicino al famoso molo di Voctoria & Alfred, vicino al centro della città, e offre appartamenti lussuosi dalla posizione unica per coloro che ricercano un alloggio esclusivo.	Idealmente situado perto do famoso V&A Waterfront, próximo do centro da cidade, estes apartamentos luxuosos são verdadeiramente uma maravilhosa localização para hóspedes que procuram alojamento sofisticado.		Quayside Apartments酒店地理位置理想，靠近著名的V&A海滨以及市中心，这家豪华的公寓项由享有美妙的地点，为客人提供高档的住宿环境。  酒店拥有17间现代化的公寓，结合时尚的装饰以及城市的壮丽美景。 您可以使用酒店建筑的许多设施，包括一间餐厅和多家商店。 健身区域包括一家健身室以及一个室内游泳池。  所有的公寓均宽敞并且配备极具品味的家具。 许多主要景点离酒店近在咫尺，适合商务及休闲旅客住宿。 流畅的线条和独特的优雅氛围使酒店成为您在开普敦逗留的理想下榻之地。		cape-town	Cape Town	5	\

15413	Miles B&B Guest House	104 Chuch Street	6620	Oudtshoorn	za	-1270304	3.0	ZAR	250	1000		4	22.1954566240311	-33.5873237469922	49016	http://www.booking.com/hotel/za/miles-bb-guest-house.html	http://aff.bstatic.com/images/hotel/org/207/2070134.jpg	Boasting panoramic views of the Swartberg Mountains, this delightful guest house is located in Oudtshoorn and welcomes guests looking to experience genuine South African hospitality.	Avec une vue panoramique sur les monts Swartberg, cette charmante guest house est située à Oudtshoorn et vous fera découvrir la véritable hospitalité sud-africaine.			Met panoramisch uitzicht op de Swartbergen is dit een heerlijk pension, gesitueerd in Oudtshoorn, en verwelkomt de gasten die opzoek zijn naar de authentieke Zuid-Afrikaanse gastvrijheid.	Questa splendida struttura vanta viste panoramiche sulle montagne Swartberg e si trova a Oudtshoorn. Vi accoglie offrendovi la tradizionale ospitalità sud africana.					oudtshoorn	Oudtshoorn	5	\

17712	See More Guest House	14 Montrose Avenue	5201	Bunkers Hill	za	-1225311	4.0	ZAR	350	750		7	27.922345	-32.996551	36651	http://www.booking.com/hotel/za/see-more-guest-house.html	http://aff.bstatic.com/images/hotel/org/116/1164234.jpg	Set in the midst of tropical gardens with rich birdlife, and with views of the Indian Ocean, See More Guest House is a haven of peace and quiet on the Eastern Cape coast.										east-london	East London	5	\

171214	Protea Hotel Umhlanga Ridge	Corner of Palm and Centenary Boulevards	4001	Umhlanga	za	-1294257	4.0	ZAR	985	1850		205	31.0840645	-29.7259097	74368	http://www.booking.com/hotel/za/protea-umhlanga-ridge.html	http://aff.bstatic.com/images/hotel/org/193/1935744.jpg	This hotel enjoys a secure location in Umhlanga's New Town Centre, overlooking the Chris Saunders Park. It is just a few minutes drive from the beach.  Protea Hotel Umhlanga Ridge combines modern amenities with traditional hospitality.										umhlanga-rocks	Umhlanga	5	\

15180	Ten Bompas Hotel	10 Bompas Road	2196	Johannesburg	za	-1240261	0.0	ZAR	3500	3500		10	28.0324636010053	-26.1312201203919	73755	http://www.booking.com/hotel/za/ten-bompas.html	http://aff.bstatic.com/images/hotel/org/676/676340.jpg	An all suite boutique hotel located close to the residential and commercial centres of Sandton and Rosebank. The hotel comprises only 10 suites each with lounge and fireplace, bedroom with king size bed opening on to a terrace or private garden.	L'hôtel se situe à proximité des quartiers résidentiels et commerçants de Sandton et de Rosebank. Il comprend 10 suites avec salon et cheminée, chambre avec lit king size donnant sur une terrasse ou un jardin privatif.	Este hotel boutique está situado cerca de la zona residencial y de los centros comerciales de Sandton y Rosebank. El hotel cuenta con solo 10 suites, que disponen de chimenea, dormitorio con cama doble con vistas a la terraza o al jardín privado.	Das Boutiquehotel Ten Bompas bietet Suiten in der Nähe der Geschäftszentren und Wohnviertel von Sandton und Rosebank.	Dit boetiekhotel met alleen maar suites ligt niet ver van de woonwijken en winkels van Sandton en Rosebank. Het hotel heeft slechts 10 suites, elk met lounge en open haard, slaapkamer met kingsize bed en toegang tot een terras of eigen tuin.	Quest'hotel, composto da suite boutique, è situato vicino ai centri residenziali e commerciali di Sandton e Rosebank.	Este boutique hotel só de suites fica perto dos centros residenciais e comerciais de Sandton e Rosebank.	Ten Bompas Hotelは、サントン（Sandton）とローズバンク（Rosebank）の住宅街と商業中心部の近くに立地する全室スイートのブティックホテルです。スイート10室のみをご用意しており、各スイートにはラウンジ、暖炉、テラスまたは専用庭園に続くベッドルーム（キングサイズベッド付き）が備わっています。併設のトレンディなレストランSidesでは館内の有名なセラーからのワインと共に豪華なお食事を召し上がれます。	这间精品酒店靠近Sandton 以及Rosebank两个住宅、商业区，为客人提供套房住宿。酒店内设有10间套房，每一间都带休息室和壁炉，寝室里有特大号床，跟露台或者私人花园相连接。我们时尚的餐厅Sample Sides供应丰盛的餐饮以及我们著名酒窖出品的葡萄酒。	Ten butikowy hotel znajduje się w pobliżu dzielnicy mieszkalnej i handlowej Sandton i Rosebank. Hotel dysponuje jedynie 10 apartamentami, każdy z salonem, kominkiem i sypialnią z łóżkiem typu kingsize, wychodzącą na taras lub prywatny ogród.	johannesburg	Johannesburg	5	\

15458	Protea Hotel Tyger Valley	Hendrik Verwoerd Drive	7530	Welgemoed, Cape Town	za	900040241	3.0	ZAR	510	1102		100	18.6010873317719	-33.8878915602876	67169	http://www.booking.com/hotel/za/protea-tyger-valley.html	http://aff.bstatic.com/images/hotel/org/930/930279.jpg	The Protea Tyger Valley is a well-positioned 3-star hotel offering great views of Table Mountain.				Protea Tyger Valley is een goed gelegen driesterrenhotel met een fantastisch uitzicht op de Tafelberg. Het hotel ligt op slechts 15 minuten rijden van het stadscentrum van Kaapstad de internationale luchthaven.				这间设备齐全的3星级酒店内能欣赏Table山的美景。酒店离开普敦市中心以及开普敦国际机场15分钟车程，离Tyger Valley 商务中心几分钟路程。  这里100间整洁的客房内有着齐全的设备，每一间房间都带现代化的浴室。房间内设有空调、茶水、咖啡机以及卫星电视等设施。每一间客房外都设有一个保安停车位。  酒店餐厅每天为您供应早餐及晚餐。客人可以于早晨享用全份英式早餐或者欧陆早餐，并于夜间享用单点美食。酒店内设有一家酒吧以及一个带壁炉的休息室。 ...		tyger-valley	Tyger Valley	5	\

46109	Aziza Guest House	5A Wright Street, Camphersdrift	6529	George	za	-1230653	3.0	ZAR	430	1560		4	22.4604935	-33.9494345	31851	http://www.booking.com/hotel/za/aziza-guest-house.html	http://aff.bstatic.com/images/hotel/org/147/1471669.jpg	Located in an up-market suburb George, boasting the Outeniqua mountains as a backdrop, this small guest house provides guests with a peaceful retreat at the heart of the Garden Route.										george	George	5	\

