id	name	address	zip	city_hotel	cc1	ufi	class	currencycode	minrate	maxrate	preferred	nr_rooms	longitude	latitude	public_ranking	hotel_url	photo_url	desc_en	desc_fr	desc_es	desc_de	desc_nl	desc_it	desc_pt	desc_ja	desc_zh	desc_pl	city_unique	city_preferred	continent_id	
46387	Cherry Tree Cottage B&B	57 Ninth Street, Linden, 	2195	Johannesburg 	za	-1240261	3.0	ZAR	500	3750		4	27.9961359500885	-26.1407654074677	98996	http://www.booking.com/hotel/za/cherry-tree-cottage-b-b.html	http://aff.bstatic.com/images/hotel/org/147/1477741.jpg	Situated in Linden, one of Johannesburg’s oldest suburbs, Cherry Tree Cottage is a family-run B&B boasting a tranquil location near Northcliff and Delta Park.  Easily accessible via the M1, Cherry Tree Cottage B&B enjoys a quiet garden setting.		Situado en Linden, uno de los barrios más antiguos de Johannesburgo, el Cherry Tree Cottage es un Bed & Breakfast de gestión familiar que cuenta con una ubicación tranquila cerca de Northcliff y Delta Park.		Het pension Cherry Tree Cottage wordt gerund door een familie. Het is een pension in Linden, een van de oudste buitenwijken van Johannsburg. Het heeft een rustige ligging in de buurt van Northcliff en Delta Park.			Cherry Tree Cottage B&Bは、ヨハネスブルグで最も古い郊外、リンデン（Linden）に位置する家族経営のベッド＆ブレックファーストです。Northcliffとデルタパーク（Delta Park）に近い静かな立地を誇っています。 ...	Cherry Tree Cottage酒店是一间家庭经营的酒店，提供住宿和早餐，位于约翰内斯堡最古老的郊区之一Linden，享有安宁的地理位置，靠近北崖和Delta公园。  Cherry Tree Cottage B&B酒店享有安静的花园环境，方便您轻松前往M1高速公路。每间舒适的套房都拥有自己的特色和迷人的特质，同时采用非洲风格进行装饰。客人可以在能够俯瞰到花园景色的私人露台上享用欧陆式早餐，还可使用传统的烧烤架。 ...	Cherry Tree Cottage to rodzinny pensjonat, położony w Linden, jednej z najstarszych dzielnic w Johannesburgu, w cichej okolicy w pobliżu dzielnicy Northcliff i parku Delta.	johannesburg	Johannesburg	5	\

15308	Baleia Guest Lodge	57 Main Road Hermanus	7200	Hermanus	za	-1236784	4.0	ZAR	450	1480		6	19.235508	-34.418791	66078	http://www.booking.com/hotel/za/baleia-guest-lodge.html	http://aff.bstatic.com/images/hotel/org/805/805021.jpg	This hotel is within easy walking distance, 300 metres, of the business centre, pubs and restaurants in Hermanus and less than a 10 minute walk from the town’s old harbour.	L'hôtel se trouve à 300 mètres du centre d'affaires, des pubs et des restaurants d'Hermanus et à moins de dix minutes de marche du vieux port.  Depuis le port, vous pourrez observer les baleines et faire de la plongée avec les requins.	El hotel está a  300 m del centro financiero, numerosos pubs y restaurantes de Hermanus, y a menos de 10 minutos a pie del antiguo puerto.								hermanus	Hermanus	5	\

171275	Villa Lugano Guesthouse	The Broads Street, Mulbarton	2058	Johannesburg 	za	-1240261	4.0	ZAR	420	3200		12	28.05964	-26.29342	93593	http://www.booking.com/hotel/za/villa-lugano-guesthouse.html	http://aff.bstatic.com/images/hotel/org/179/1799336.jpg	Located in Mulbarton, a scenic suburb of Johannesburg, this exclusive guest house impresses with its Mediterranean-style décor and impeccable service.		El Villa Lugano Guesthouse está situado en Mulbarton, un pintoresco barrio de Johannesburgo. Ofrece una decoración mediterránea y un impecable servicio.		Gelegen in Mulbarton, een schilderachtige voorstad van Johannesburg, maakt dit exclusieve pension indruk met het Mediterrane décor en een onberispelijke service.		Localizado em Mulbarton, um pitoresco subúrbio de Joanesburgo, esta exclusiva casa de hóspedes impressiona com a sua decoração mediterrânica e serviço impecável.	ヨハネスブルグの美しい郊外、Mulbartonに位置する排他的なゲストハウスで、地中海風の装飾、優れたサービスが自慢です。  Villa Lugano Guesthouseは、ORタンボ国際空港（OR Tambo International Airport）からわずか20分の場所にある贅沢な隠れ家です。プールのそばでリラックスしたり、ガーデンで日光浴をしながら1日をお過ごしください。エクササイズにはジムを利用できます。 ...	坐落在Mulbarton，风景优美的约翰内斯堡郊区，这家独特的酒店拥有令人印象深刻的地中海式风格装饰以及完美的服务。  距离OR Tambo国际机场只有20分钟，Villa Lugano宾馆是您豪华的住所。您可以花一天的时间在池边放松，在花园里晒太阳或是在健身房运动。  Villa Lugano宾馆设有自己的餐馆，客人可以享受家庭烹饪的晚餐以及美味的葡萄酒。 想要享受美好天气的客人可以使用烧烤设施。 ...		johannesburg	Johannesburg	5	\

171221	The Village Lodge Townhouses & Suites	49 Napier Street, De Waterkant	8001	Cape Town 	za	-1217214	4.0	ZAR	750	5500		10	18.4165513515472	-33.9160754371298	99484	http://www.booking.com/hotel/za/the-village-lodge-suites.html	http://aff.bstatic.com/images/hotel/org/163/1638902.jpg	Right at the centre of Cape Town’s De Waterkant Village, The Village Lodge Townhouses and Villa Suites offers innovative accommodation on the slopes of Signal Hill.								位于开普敦的De Waterkant村中心，Village Lodge Townhouses and Villa Suites酒店在Signal山的山麓上为您提供创新的住宿。  设有每日服务，每间住宿单位均设有现代风格，从酒店步行可抵达是中心和各处景点，如V&A海滨。酒店每日为您提供丰盛的早餐。  客人可适用酒店的所有设施，包括旅游咨询台和游泳池。在Soho餐厅用餐，每日07:30和22:30之间您可品尝各式亚洲美食。  酒店还提供免费无线互联网、提车场以及机场班车。		cape-town	Cape Town	5	\

18583	Ekhaya Bed and Breakfast	151 Admiralty Way	6001	Port Elizabeth	za	-1273448	3.0	ZAR	660	1800		5	25.6482642889023	-33.9996372085653	72146	http://www.booking.com/hotel/za/ekhaya-bed-and-breakfast.html	http://aff.bstatic.com/images/hotel/org/115/1158867.jpg	Situated in a seaside suburb of Port Elizabeth, Ekhaya offers affordable, friendly, and convenient self-catering or bed and breakfast accommodation on Eastern Cape’s delightful Garden Route.				Het Ekhaya ligt in een buitenwijk (aan zee) van Port Elizabeth. Het is een vriendelijke en betaalbare accommodatie, zowel zelfvoorzienend of halfpension. Het ligt op de prachtige Tuinroute langs de Oost-Kaap.		Situado num subúrbio costeiro de Port Elizabeth, o Ekhaya oferece uma acolhedora, económica e conveniente acomodação auto-suficiente ou de alojamento e pequeno-almoço na maravilhosa Garden Route do Cabo Oriental.				port-elizabeth	Port Elizabeth	5	\

171363	Protea Hotel Clarens	c/o Main & van der Merwe Street	9707	Clarens	za	-1217988	4.0	ZAR	830	1530		70	28.4221190214157	-28.5132267882525	66011	http://www.booking.com/hotel/za/protea-clarens.html	http://aff.bstatic.com/images/hotel/org/214/2147495.jpg	Framed by majestic mountains and sandstone cliffs, this 4-star hotel is ideally located in the picturesque town of Clarens, Eastern Free State.										clarens	Clarens	5	\

15550	Ocean Eleven Guesthouse	11 Westcliff Road	7200	Hermanus	za	-1236784	5.0	ZAR	1100	3300		10	19.2343032360077	-34.423752890957	77684	http://www.booking.com/hotel/za/ocean-eleven-guesthouse.html	http://aff.bstatic.com/images/hotel/org/968/968988.jpg	Ideally situated on the cliffs of Hermanus, boasting a phenomenal vista of Walker Bay, this guest house continues to retain the elegance of colonial architecture.	Idéalement située sur les falaises d'Hermanus et jouissant d'une vue magnifique sur Walker Bay, cette guesthouse a gardé l'élégance de l'architecture coloniale.	Ubicado en los acantilados de Hermanus, con una magnífica vista de Walker Bay, este hotel conserva la elegancia de la arquitectura colonial.								hermanus	Hermanus	5	\

49846	Quarters Hotel Avondale Road	335 Avondale Road, Morningside	4001	Durban	za	-1224926	4.0	ZAR	1540	7000		17	31.0155175	-29.8338494	60174	http://www.booking.com/hotel/za/quarters-avondale-road.html	http://aff.bstatic.com/images/hotel/org/182/1820022.jpg	Quarters Hotels pride itself in being an all-female management hotel, offering quiet luxury rooms with decadent furnishings.				Quarters Hotels is een geheel door vrouwen geleid hotel. Het biedt rustige kamers met decadente, luxe meubels.		O Quarters Hotel orgulha-se de ser um hotel completamente gerido por mulheres, e oferece quartos calmos e com mobiliário luxuoso.	Quarters Hotelはすべて女性で経営されたホテルで、素晴らしい家具が備わる静かで豪華な客室を提供しています。  ダーバンの一流レストランから徒歩圏内、ダーバンビーチから5分、ダーバン国際空港から20分、国際コンベンションセンターからわずか10分です。  細部にまで行き渡るサービスや柔らかな雰囲気を提供し、できる限り快適に楽しく過ごせるようお約束します。	Quarters Hotel酒店以其完全由女性经营的特点为荣，提供带有奢华陈设的宁静豪华客房。  酒店位于Durban顶级餐馆的步行范围内，距离Durban海滩5分钟，距离Durban国际机场20分钟，距离国际会议中心仅有10分钟。  客人可以享受细心周到的服务、柔和的风格以及让您尽享舒适愉悦住宿的承诺。		durban	Durban	5	\

171357	The Walden Suites	12 Bellwood Road	8005	Cape Town	za	-1217214	5.0	ZAR	950	3300		7	18.383294	-33.9266417	95670	http://www.booking.com/hotel/za/the-walden-suites.html	http://aff.bstatic.com/images/hotel/org/195/1954252.jpg	Below Lions Head lies the stylish, elegant Villa, Walden Suites provide quiet, sunny accommodation with fantastic views of the Atlantic Ocean, Robben Island and Table Bay.								Lions Head下坐落着的是一座典雅的别墅，即Walden Suites酒店，环境幽雅，阳光明媚，享有大西洋、Robben岛和Table湾的美丽景致。  大部分的客房均可直接通往阳台和露台，所有的客房都享有山景、花园景或海景。所有的客房都配备了卫星电视、电话、收音机闹钟和一张工作台。  客人可在酒店各处24小时使用无线互联网服务，也可以在咸水游泳池畔的日光露台上度过轻松、懒散的一天。 ...		cape-town	Cape Town	5	\

15661	Alexani Guesthouse	226 Ramona Street, Erasmusrand	0181	Pretoria 	za	-1273769	3.0	ZAR	450	2000		4	28.253011	-25.810067	97098	http://www.booking.com/hotel/za/alexani-guesthouse.html	http://aff.bstatic.com/images/hotel/org/103/1030086.jpg	Offering the warmth of home-style luxury living in the leafy suburbs of Erasmusrand, Pretoria, this elegant guesthouse provides complete tranquillity for a relaxing break, whilst being within easy reach of all major centres.	Cette guest house élégante offre la chaleur du luxe et du confort dans les faubourgs verdoyants de Pretoria et la tranquillité de ses environs vous permettra de vous relaxer totalement tout en restant proche des centres principaux.	Este elegante hotel ofrece un ambiente cálido de lujo en las frondosas afueras de Erasmusrand, Pretoria. Presenta un entorno tranquilo ideal para pasar unos días de relax, a poca distancia de los principales centros.		Dit elegante pension in de groene buitenwijk van Erasmusrand in Pretoria biedt warme, huiselijke luxe en complete rust voor een ontspannen vakantie, terwijl u tegelijkertijd de belangrijke centra eenvoudig kunt bereiken.		Oferecendo o calor de uma luxuosa residência de estilo familiar na frondosa periferia de Erasmusrand, Pretória, esta elegante estalagem oferece completa tranquilidade para uma estadia relaxante, apesar de ter fácil acesso a todos os grandes centros.		Alexani Guesthouse酒店提供家庭式豪华住宿的温馨氛围，位于比勒陀利亚，Erasmusrand的绿叶郊区。这家典雅的酒店为您轻松逗留提供完全宁静的氛围，您也可以便捷的到达所有主要中心。  酒店距离比勒陀利亚市中心不到15分钟，离Menlyn和Brooklynn购物中心也只有4公里。 只需30分钟的车程就将带您到达O.R.		pretoria	Pretoria	5	\

17829	Protea Hotel Midrand	14th Street, Noordwyk Ext 20	1685	Midrand 	za	437319	4.0	ZAR	850	2305		177	28.131458	-25.956461	97532	http://www.booking.com/hotel/za/protea-midrand.html	http://aff.bstatic.com/images/hotel/org/113/1132844.jpg	Situated halfway between Johannesburg and Pretoria, in a delightful landscaped garden, the 4–star Protea Hotel Midrand offers quality accommodation in the vibrant region of Gauteng.								这间4星级Protea Hotel Midrand 酒店位于Johannesburg 和Pretoria 中间的位置，处于一个景色优美的花园之中，提供优质的客房，处于充满活力的Gauteng 区。  Protea Midrand 酒店拥有典雅的装饰，给人宾至如归的感觉，方便客人前往当地的商业区，或使用休闲设施。  您可到露台上品尝丰盛的早餐，开始新的一天。然后，您可到泳池区晒太阳或游览Koi 池，欣赏花园中的瀑布。 您可到酒店附近参加许多活动，如打高尔夫球和骑马，而且酒店细心的员工可为您安排。 ...		midrand	Midrand	5	\

22948	Oak Village B&B	7 Hamman Street	7600	Stellenbosch	za	-1287082	3.0	ZAR	600	1800		7	18.857405	-33.940385	46616	http://www.booking.com/hotel/za/oak-village-bb.html	http://aff.bstatic.com/images/hotel/org/125/1252823.jpg	Nestled in the town centre of historical Stellenbosch, perfect for a memorable Cape Winelands holiday, this guest house welcomes guests looking to experience genuine Cape hospitality.				Dit pension ligt in het centrum van de historische Stellenbosch, en is perfect voor een onvergetelijke vakantie in de Cape Winelands. Hier kunt u de echte Kaapse gastvrijheid ervaren.						stellenbosch	Stellenbosch	5	\

17798	Jemima's Hospitality, Bunker on Bailie	30 John Bailie Road, Bunkers Hill	5241	East London	za	-1225311	4.0	ZAR	350	780		14	27.925	-32.9967	41014	http://www.booking.com/hotel/za/jemimas-hospitality-bunker-on-baillie.html	http://aff.bstatic.com/images/hotel/org/114/1147034.jpg	Jemina’s Hospitality, located in an exclusive, leafy area of East London on the Eastern Cape coast, combines a relaxed Moorish atmosphere with French boutique-style accommodation.										east-london	East London	5	\

19112	Zomerlust Gastehuis	193 Main Road	7646	Paarl	za	-1270835	4.0	ZAR	640	1280		14	18.9627832174301	-33.7431302210226	24174	http://www.booking.com/hotel/za/zomerlust-gastehuis.html	http://aff.bstatic.com/images/hotel/org/118/1183266.jpg	Lying in the spectacular Paarl valley, in the midst of the Cape Winelands and about 60 kilometres from Cape Town and the ocean coast, Zomerlust Gastehuis welcomes you.										paarl	Paarl	5	\

45824	One&Only Cape Town	Dock Road, Victoria & Alfred Waterfront	8001	Cape Town	za	-1217214	5.0	ZAR	3825	55000		131	18.4165620803833	-33.9094955805208	49394	http://www.booking.com/hotel/za/one-only-cape-town.html	http://aff.bstatic.com/images/hotel/org/195/1954076.jpg	Setting a new standard of luxury in Cape Town, this hotel is an oasis of style at the V&A Waterfront and impresses guests with sublime service and facilities.								这间酒店是坐落于V&A海滨风格独特的绿洲酒店，为开普敦（Cape Town）地区酒店的豪华的设立了新的标准，并为客人提供精良的设施以及高标准的优质服务。  One&Only Cape Town酒店可以欣赏到Marina和Table山的全景，拥有城内最大的客房和套房。房间以本地的、现代风格的艺术品装饰，配备了超大型的大理石浴室，内部设有淋浴和独立的洗浴空间，每一间房的设计都证明了酒店对细节的关注。 ...		cape-town	Cape Town	5	\

171282	Auberge Hollandaise	106 Kenneth Kuanda (Northway)	4051	Durban	za	-1224926	5.0	ZAR	1000	1650		10	31.033915	-29.7898749	59528	http://www.booking.com/hotel/za/auberge-hollandaise.html	http://aff.bstatic.com/images/hotel/org/180/1809613.jpg	Just a short drive from Durban's International Convention Centre, this guest house in the heart of the city provides guests with all the comforts of a country home.				Dit pension ligt slechts op een korte afstand rijden van de expositiehal Durban International Convention Centre. Het ligt in het hart van de stad en biedt gasten alle comfort van een landhuis.		Apenas a uma pequena viagem do Centro Internacional de Convenções de Durban, esta casa de hóspedes está situada no coração da cidade, e oferece aos hóspedes todo o conforto de uma casa de campo.	ダーバンのインターナショナル・コンベンションセンター（International Convention Centre）から車でわずかな距離にあるこのゲストハウスは、市内中心部に位置し、田舎の家ような快適さをすべて完備しています。  伝統的なおもてなしとモダンなデザインを組み合わせたAuberge Hollandaiseは、大型屋外プールなどの豪華な設備を完備しています。 ...	这家位于市中心的酒店距离Durban的国际会议中心仅有一小段车程，为客人提供乡间住宅的所有舒适设施。  Auberge Hollandaise酒店结合了现代设计和传统款待，其大型户外游泳池等豪华设施令人印象深刻。  早晨，您可以在室外享用早餐并俯瞰波光粼粼的游泳池。之后，您可以享用免费无线网络连接，同时让细心的员工应您的要求安排按摩服务。  10间客房均陈设舒适并设有大窗户。您可以在床上看报纸或者在花园享受日光浴。Auberge Hollandaise酒店亦设有一间小型图书馆。		durban	Durban	5	\

17689	Rhino Walking Safaris	Kruger National Park	1350	Skukuza	za	-1256992	4.0	ZAR	3367	5980		8	31.39347	-24.55241	17029	http://www.booking.com/hotel/za/rhino-walking-safaris.html	http://aff.bstatic.com/images/hotel/org/111/1117264.jpg	Rhino Walking Safaris lies in the Kruger National Park, the largest game reserve in South Africa, and offers an unrivalled wilderness and wildlife experience.								Rhino Walking Safaris 酒店位于Kruger 国家公园里，那里是南非最大的野外观光保护区，提供无敌的荒野与野外生活的经历。  酒店拥有两个营地，Plains Camp 和 Rhino Post Safari Lodge，在壮丽的景色中提供各种住宿选择。酒店拥有舒适的探险者风格帐篷与典雅、环保的套房，将家的舒适完美地融合于真正的拓荒者传统和安详的过去之中。 ...		manyeleti	Manyeleti	5	\

15431	Poseidon Lodge	22 Poseidon Crescent, Bluewater Beach	6210	Bluewater Bay, Port Elizabeth 	za	-1273448	4.0	ZAR	380	2800		6	25.640312	-33.848036	71832	http://www.booking.com/hotel/za/poseidon-lodge.html	http://aff.bstatic.com/images/hotel/org/145/1455465.jpg	Situated close to the centre of Port Elizabeth, boasting stunning views of the Indian Ocean, this lodge has a private beach entrance and offers affordable rates.										port-elizabeth	Port Elizabeth	5	\

15163	Protea Hotel Breakwater Lodge	 9 Portswood Road, V&A 	8002	Cape Town	za	-1217214	0.0	ZAR	745	14451		192	18.4156320974615	-33.9070715729514	97076	http://www.booking.com/hotel/za/breakwater-lodge.html	http://aff.bstatic.com/images/hotel/org/174/1746677.jpg	This hotel provides free gym access and affordable accommodation in the heart of Cape Town's V & A Waterfront. It is just 1 minute away from the city's restaurants, theatres, and shops.	Cet hôtel propose un hébergement abordable et idéalement situé au cœur du V & A Waterfront de Cape Town, à seulement 1 minute des restaurants, des théâtres et des boutiques de la ville.	Este hotel ofrece acceso gratuito al gimnasio y un alojamiento asequible en el corazón del V & A Waterfront, en Ciudad del Cabo. Se encuentra a 1 minuto de los restaurantes, teatros y tiendas de la ciudad.	Dieses Hotel befindet sich im Herzen von Kapstadts V&A Waterfront und bietet günstige Unterkünfte sowie ein kostenloses Fitnesscenter.  Die Restaurants, Theater und Geschäfte der Stadt liegen nur 1 Minute vom Hotel entfernt.	Dit hotel biedt gratis toegang tot de fitnessruimte en betaalbare accommodatie in het hart van het V&A Waterfront in Kaapstad. Het bevindt zich op slechts 1 minuut afstand van de restaurants, theaters en winkels van de stad.	Questo hotel offre l'accesso gratuito alla palestra e delle sistemazioni confortevoli nel cuore del V&A Waterfront di Città del Capo, a 1 minuto dai ristoranti, dai teatri e dai negozi della città.	Este hotel oferece acesso gratuito ao ginásio e acomodação económica no coração do Passeio Marítimo V&A da Cidade do Cabo. Está apenas a 1 minuto dos restaurantes, teatros e lojas da cidade.		这家酒店位于开普敦V & A Waterfront滨水区的中心，让客人免费使用健身房并提供价格实惠的住宿。酒店距离市内的餐馆、剧院和商店仅有一分钟。  Protea Hotel Breakwater Lodge酒店坐落于一间历史悠久的19世纪监狱内，俯瞰着海港以及桌山(Table Mountain)。酒店的一些原有装置反映出酒店的历史。  客房类型包括标准间至商务间以及家庭间，客人可以选择吸烟客房或禁烟客房。酒店为儿童提供Prokidz休息室。  Breakwater...		cape-town	Cape Town	5	\

15643	Simpson's Manor & Restaurant	43 Potgieter street	1390	Phalaborwa  	za	-1272150	0.0	ZAR	240	700		7	31.1280655860901	-23.9439927437178	12972	http://www.booking.com/hotel/za/simpsons-manor.html	http://aff.bstatic.com/images/hotel/org/165/1657466.jpg	Just a short drive Kruger National Park, this manor is located in the town of Phalaborwa and impresses with its elegant interior.  Offering only a small number of guest rooms, Simpson's Manor & Restaurant radiates an intimate atmosphere.	Ce manoir situé  à une courte distance de route du parc national Kruger à Phalaborwa vous impressionnera par ses intérieurs élégants.  Avec son petit nombre de chambres, le Simpson's Manor & Restaurant vous offre une atmosphère intime très agréable.			Het Simpson's Manor & Restaurant ligt op een korte rit van het Kruger Nationaal Park. Dit landhuis bevindt zich in het stadje Phalaborwa en zal u versteld doen staan met zijn elegante interieur.						phalaborwa	Phalaborwa	5	\

15709	Amber Guest Lodge	11 Duthie Street, Rexford	6570	Knysna	za	-1246436	4.0	ZAR	640	1180		4	23.078239	-34.064586	77420	http://www.booking.com/hotel/za/amber-guest-lodge.html	http://aff.bstatic.com/images/hotel/org/186/1861182.jpg	Amber Guest Lodge offers luxurious bed & breakfast accommodation overlooking the magnificent Knysna lagoon, the destination of choice along Western Cape’s Garden Route.										knysna	Knysna	5	\

15234	Olaf's Guest House	24 Wisbeach Rd. 	8005	Sea Point, Cape Town	za	-1217214	4.0	ZAR	624	2750		9	18.3917999267578	-33.9111294624201	93592	http://www.booking.com/hotel/za/olaf-s-guest-house.html	http://aff.bstatic.com/images/hotel/org/739/739053.jpg	Olaf's Guest House is located in the Cape Town suburb of Sea Point, only 10 minutes from the city centre and the new 2010 Green Point Soccer Stadium.	La Guest House Olaf est située aux abords du Cap, à Sea Point, à 10 minutes seulement du centre-ville et du nouveau stade de football le 2010 Green Point Soccer Stadium.	El Olaf's Guest House está situado en el barrio Sea Point de Ciudad del Cabo, a sólo 10 minutos del centro de la ciudad y del nuevo estadio de fútbol Green Point (para la Copa Mundial de la FIFA en 2010).	Olafs Gästehaus liegt in Sea Point, einem Vorort von Cape Town, nur 10 Minuten vom Stadtzentrum und dem neuen für die Fußballweltmeisterschaft 2010 errichteten Green Point Stadion entfernt.					Olaf's Guest House宾馆位于开普敦的Sea Point城郊地区，距离市中心和新建的2010年绿点足球场仅10分钟路程。  这间高级宾馆坐落于Main Road和Beach Road之间，就在信号山山脚下。该宾馆靠近时髦的Long大街和Kloof大街及其餐厅和咖啡厅，维多利亚阿尔弗雷德码头广场，以及营湾和桌山缆车站。在宾馆的步行距离之内可以找到网吧。  宾馆的工作人员将会热心帮助您在开普敦地区找到餐馆、海滩和葡萄酒吧。		cape-town	Cape Town	5	\

15584	d'Ouwe Werf Hotel	30 Church Street	7600	Stellenbosch	za	-1287082	4.0	ZAR	445	2420		38	18.8622	-33.9376	86615	http://www.booking.com/hotel/za/ouwe-werf.html	http://aff.bstatic.com/images/hotel/org/982/982988.jpg	South Africa's oldest and most historic hotel, this property is only 45 km from Cape Town, 20 km from the sea, and surrounded by beautiful mountains.				D'Ouwe Werf Hotel is Zuid-Afrika's oudste en meest historische hotel en ligt op slechts 45 km van Kaapstad, 20 km van de zee, en wordt omringd door prachtige bergen.						stellenbosch	Stellenbosch	5	\

