id	name	address	zip	city_hotel	cc1	ufi	class	currencycode	minrate	maxrate	preferred	nr_rooms	longitude	latitude	public_ranking	hotel_url	photo_url	desc_en	desc_fr	desc_es	desc_de	desc_nl	desc_it	desc_pt	desc_ja	desc_zh	desc_pl	city_unique	city_preferred	continent_id	
49798	The One 8 Hotel	18 Antrim Road	8005	Cape Town	za	-1217214	4.0	ZAR	695	2295		8	18.4003852	-33.9091016	98274	http://www.booking.com/hotel/za/the-one-8.html	http://aff.bstatic.com/images/hotel/org/160/1604457.jpg	Boasting a central location in Cape Towns Three Anchor Bay, this guest house is close to the V&A Waterfront and provides guests with comfortable accommodation.  Offering secure parking and other benefits, The One 8 Hotel is a welcome retreat.								位于开普敦三锚湾的中心，这家宾馆邻近V＆A Waterfront区，并为客人提供舒适的住宿。  One 8酒店设有安全的停车场及其他设施，为您提供舒适的独家居所。在酒店的游泳池旁享受阳光，或在按摩浴缸中享用酒水。  由于酒店设有少数客房，酒店拥有温馨亲切的气氛。客房内设有私人阳台。所有的客房均设有轻快的色彩和现代化的家具，客房均位于底层，可直通花园。  酒店业主可帮您租用自行车或汽车。当您回到酒店，则可在酒吧里享用饮料和小食。如果您愿意，酒店也可为您安排外卖餐。		cape-town	Cape Town	5	\

171201	House on Westcliff	96 Westcliff Road	7200	Hermanus 	za	-1236784	4.0	ZAR	500	1100		6	19.225306	-34.429853	64658	http://www.booking.com/hotel/za/house-on-westcliff.html	http://aff.bstatic.com/images/hotel/org/176/1766668.jpg	Only a 5-minute drive from the town centre, overlooking the cliffs and ocean, this guest house combines African and European design in the heart of Hermanus.  Each of the guest rooms is spacious in layout and includes individual furnishings.										hermanus	Hermanus	5	\

171304	Protea Hotel Riempie Estate	Baron Van Reede Street	6620	Oudtshoorn	za	-1270304	3.0	ZAR	382.5	1575		39	22.2045707702637	-33.5736025638347	42913	http://www.booking.com/hotel/za/protea-riempie-estate.html	http://aff.bstatic.com/images/hotel/org/189/1897306.jpg	Offering an authentic African haven, Protea Hotel Riempie Estate is a privately owned hotel surrounded by greenery, right in the heart of Klein Karoo, Oudtshoorn.										oudtshoorn	Oudtshoorn	5	\

15494	Lombardy Boutique Hotel & Conference Venue	Lynnwood Road	1033	Lynnwood, Pretoria	za	-1273769	5.0	ZAR	2760	2760		16	28.361064	-25.792453	49159	http://www.booking.com/hotel/za/lombardy-boutique-conference-venue.html	http://aff.bstatic.com/images/hotel/org/904/904882.jpg	Situated in the east of Pretoria, on a large private estate, this sophisticated boutique hotel is close to Gauteng and maintains a unique and tranquil atmosphere.				Dit moderne boetiekhotel ligt in het oosten van Pretoria, op een groot privéterrein vlakbij Gauteng. Er heerst een unieke en rustige atmosfeer.				这家典雅的精品酒店坐落在Pretoria东部一个巨大的私人住宅区中，紧邻豪登省（Gauteng），保留了一种独特的宁静气氛。  Lombardy Boutique Hotel & Conference Venue四周环绕着美丽的风景花园，提供卓越的服务和优质的设施。早晨醒来在床上享用一顿早餐，然后可到图书馆或商务中心放松或工作。  Lombardy酒店也是一个卓越的会议场地。您可在图书馆中为会议做准备，也可在餐厅内享用一顿一流的商务午餐。酒店的3间多功能间旁边，还设有深受欢迎的The...		pretoria	Pretoria	5	\

15427	Greenways Hotel	1 Torquay Avenue	7708	Claremont, Cape Town 	za	900040023	5.0	ZAR	1725	5160		17	18.457489	-33.993742	76522	http://www.booking.com/hotel/za/greenways.html	http://aff.bstatic.com/images/hotel/org/867/867069.jpg	Set amongst six acres of enchanting garden, in the up market suburb of Upper Claremont, this historical Manor House offers the discerning traveller the luxury of utter relaxation.		Ubicada en un encantador jardín de 2,4 hectáreas en el barrio de Upper Claremont, esta histórica casa solariega ofrece una estancia de lujo  y relax.								claremont-za	Claremont	5	\

15195	Protea Hotel President	4 Alexander Rd	8001	Cape Town	za	-1217214	4.0	ZAR	940	2645	1	353	18.3793115615845	-33.9234204143784	110409	http://www.booking.com/hotel/za/protea-president.html	http://aff.bstatic.com/images/hotel/org/151/1519983.jpg	Just a short walk from Cape Town's famous V&A Waterfront, this hotel is close to Camps Bay and impresses with its many facilities.	À quelques pas du célèbre front de mer de V&A, le Protea Hotel President est situé à proximité de Camps Bay et impressionne par ses nombreuses installations.  Il offre des vues sur la mer et sur la ville.	A un corto trayecto del famoso V & A Waterfront de Ciudad del Cabo, este hotel está cerca de Camps Bay e impresiona con sus numerosos servicios.	Nur wenige Schritte trennen dieses Hotel mit seiner umfassenden Ausstattung von der berühmten V&A Waterfront Kapstadts. Sie wohnen außerdem nahe Camps Bay.	Dit hotel ligt dicht bij Camps Bay, op een korte wandeling van het bekende V&A Waterfront van Cape Town, en biedt een indrukwekkend scala aan faciliteiten.  Protea Hotel President geniet van een prachtig stads- en zeezicht.	Situato a breve distanza di cammino dal famoso V&A Waterfront di Città del Capo, quest'hotel si trova vicino a Camps Bay e vi colpirà per tutte le sue dotazioni.	A um curto passeio do famoso Passeio Marítimo V&A da Cidade do Cabo, este hotel está perto de Camps Bay e impressiona pelas muitas comodidades.		Protea Hotel President酒店距离开普敦著名的V&A海滨仅几步之遥，靠近Camps Bay海湾并且配备令人印象深刻的设施。  酒店拥有城市和海景，是开普敦最大的海滨会议场所地点之一。 您可以前往酒店的理发室或是在健身室锻炼。 其他酒店设施包括一间按摩房、礼品店和室外泳池。  该餐厅全天开放，而且由于是现场表演，更加营造了一种特别的用餐体验。 您可以使用室内点餐服务或是在酒吧喝一杯饮料。 您也可以在毗邻游泳池的室外场地享用鸡尾酒和其他饮料。 ...		cape-town	Cape Town	5	\

15548	Nenya Guesthouse	19 Meadow Lane	7806	Hout Bay	za	-1238569	3.0	ZAR	450	1000		4	18.372397	-34.022611	55813	http://www.booking.com/hotel/za/nenya-guesthouse.html	http://aff.bstatic.com/images/hotel/org/200/2003000.jpg	Nenya Guesthouse is situated close to World of Birds Park, 20 minutes from Cape Town and not far from the fishing village of Hout Bay.  Nenya Guesthouse features spectacular 360 degree mountain views with a backdrop of Table Mountain Nature Reserve.	La maison d'hôte Nenya Guesthouse est située à proximité du parc World of Birds, à 20 minutes du Cap et non loin du village de pêcheurs de Hout Bay.			Het Nenya Guesthouse ligt dicht bij World of Birds Park, op 20 minuten van Kaapstad en niet ver van het vissersdorpje Hout Bay.  Het Nenya Guesthouse beschikt over een spectaculair uitzicht op de bergen.						houtbaai	Hout Bay	5	\

15616	Beachside Villa & Penthouse	14 Central Drive	8005	Camps Bay, Cape Town	za	900040022	5.0	ZAR	1050	9900		8	18.379197	-33.951203	71095	http://www.booking.com/hotel/za/beachside.html	http://aff.bstatic.com/images/hotel/org/997/997162.jpg	Ideally situated only minutes from Camps Bay Beach, overlooking the spectacular Twelve Apostles and Atlantic Ocean, this establishment provides you with 5-star accommodation in an unbeatable location.	Idéalement situé à quelques minutes seulement de la plage de Camps Bay, avec vue sur la montagne des Douze Apôtres et sur l'océan Atlantique, cet établissement vous propose un hébergement 5 étoiles à un emplacement sans égal.	El hotel goza de una excelente ubicación a pocos minutos de Camps Bay Beach, con vistas a los espectaculares Doce Apóstoles y al océano Atlántico. Ofrece un alojamiento de 5 estrellas en una zona incomparable.	In idealer Lage nur wenige Minuten vom Camps Bay Beach entfernt bietet das Deluxe-Boutiquehotel 5-Sterne-Unterkünfte mit faszinierendem Blick auf die Zwölf Apostel und den Atlantischen Ozean.	Dit luxe etablissement biedt vijfsterrenaccommodatie op een uitstekende locatie. Op enkele minuten vindt u Camps Bay Beach, en u kijkt er uit op de spectaculaire Twaalf Apostelen en de Atlantische Oceaan.		Idealmente situado apenas a alguns minutos da Praia de Camps Bay, com vista sobre o espectacular Doze Apóstolos e o Oceano Atlântico, este estabelecimento oferece-lhe uma acomodação de 5 estrelas com uma localização imbatível.				camps-bay-za	Camps Bay	5	\

171326	Harbour Vue Guesthouse	84 Westcliff rd,	7200	Hermanus 	za	-1236784	4.0	ZAR	650	3000		5	19.224885	-34.430647	61488	http://www.booking.com/hotel/za/harbour-vue-guesthouse.html	http://aff.bstatic.com/images/hotel/org/188/1889459.jpg	Harbour Vue Guest House is a sea-facing luxurious 4-star guesthouse overlooking the bay and the New Harbour and Whale Watching in Hermanus.  Harbour Vue Guest House is built around an outdoor swimming pool.										hermanus	Hermanus	5	\

15539	African Oceans Manor on the Beach	7 Bob Bouwer Cresent	6500	Mossel Bay	za	-1262929	5.0	ZAR	700	1880		9	22.109	-34.14	87760	http://www.booking.com/hotel/za/african-oceans-manor-on-the-beach.html	http://aff.bstatic.com/images/hotel/org/959/959936.jpg	Inspired by the waves rolling onto the golden sand and the majestic Outeniqua Mountains, this award-winning 5-star guesthouse guarantees a special and memorable stay.	Inspiré par les vagues qui s'échouent sur le sable doré et les majestueuses montagnes d'Outeniqua, cette propriété 5 étoiles primée vous garantit un séjour mémorable et spécial.			Dit bekroonde vijfsterrenpension wordt geïnspireerd door de golven op het goudkleurige strand en de majestueuze Outeniqua-bergen. Hier heeft u een bijzonder en onvergetelijk verblijf.						mossel-bay	Mossel Bay	5	\

15506	Parker Cottage	3 Carstens Street, Tamboerskloof	8001	Cape Town 	za	-1217214	4.0	ZAR	850	1450		8	18.4079790115356	-33.9287262100414	85250	http://www.booking.com/hotel/za/1-on-carstens-parker-cottage.html	http://aff.bstatic.com/images/hotel/org/932/932289.jpg	Close to Cape Towns attractions, this 4-star guest house at the foot of Table Mountain offers cosy and beautiful rooms, free WiFi, and excellent services.  Parker Cottage radiates a warm and welcoming atmosphere.	Cette guest house 4 étoiles située au pied de la Montagne de la Table se trouve à proximité des sites du Cap.  Le Parker Cottage occupe un bâtiment victorien restauré avec soin et dégage une atmosphère accueillante et chaleureuse.	Este hotel de 4 estrellas situado a los pies del monte Table está a un corto paseo de los lugares de interés de Ciudad del Cabo; un lugar ideal para pasar una estancia inolvidable.	Von diesem 4-Sterne-Hotel am Fuße des Tafelbergs trennen Sie nur wenige Schritte von den Sehenswürdigkeiten Kapstadts. Erleben Sie hier einen angenehmen Aufenthalt.	Dit viersterrenverblijf aan de voet van de Tafelberg ligt op korte afstand van de attracties in Kaapstad. Dit maakt het tot een ideale uitvalsbasis voor een onvergetelijk verblijf.	Questa pensione a quattro stelle, situata ai piedi della Montagna della Tavola, sorge a breve distanza dalle attrazioni di Città del Capo, risultando così una base ideale per trascorrere un soggiorno indimenticabile.			Parker Cottage酒店靠近开普敦的景点，这家四星级的酒店位于Table Mountain(桌山)的山脚，为您提供舒适合迷人的客房、免费无线网络连接和一流的服务。  酒店营造出温馨和热情的氛围。 您可以在阳台上或是冬季的时候在用餐室享受美食。 酒店所有公共和私人区域设有原始的艺术作品，更加增添了酒店的独特魅力。  细心的工作人员将非常乐意为您安排汽车租赁或是前往机场的穿梭巴士服务。 所有客房都经过单独装饰并且注重细节。 您可以在露台上放松或是前往游览花园区域。...		cape-town	Cape Town	5	\

15560	Apple Tree Guest House	6 Paul Kruger Street	7600	Stellenbosch 	za	-1287082	4.0	ZAR	600	1600		8	18.8544809818268	-33.9306846417056	61721	http://www.booking.com/hotel/za/apple-tree-guest-house.html	http://aff.bstatic.com/images/hotel/org/973/973059.jpg	Only 10 minutes' walk from Stellenbosch's town centre, designed with the local mild climate in mind, this contemporary guest house presents guests with a refreshingly unique retreat.		A solo 10 minutos del centro de Stellenbosch, diseñado para ofrecer un ambiente cálido, este contemporáneo hotel presenta un refugio único.		Dit moderne pension ligt op slechts 10 minuten lopen van het stadscentrum van Stellenbosch. Het ontwerp van het pension heeft rekening gehouden met het milde, lokale klimaat. U kunt hier genieten van een verfrissende en unieke retraite.						stellenbosch	Stellenbosch	5	\

171339	33 on First Guesthouse	33 1st Ave	2109	Johannesburg 	za	-1240261	3.0	ZAR	495	2100		6	28.001795	-26.1786364	88472	http://www.booking.com/hotel/za/33-on-first-guesthouse.html	http://aff.bstatic.com/images/hotel/org/191/1917076.jpg	This cosy 3-star guesthouse is situated 5 minutes from the main north and south freeways leading to Pretoria, Sandton and Johannesburg International Airport.										johannesburg	Johannesburg	5	\

15314	The View Guest Lodge	9 Hillside Road	4126	Amanzimtoti	za	-1207027	5.0	ZAR	650	1500		20	30.868087	-30.067951	63299	http://www.booking.com/hotel/za/the-view-guest-lodge.html	http://aff.bstatic.com/images/hotel/org/186/1860808.jpg	This unique lodge with sweeping views of the Indian Ocean is ideally situated 12 kilometres from Durban airport, in the coastal village of Doonheights.  At The View Guest Lodge you are assured of 5-star service and attention to detail.										amanzimtoti	Amanzimtoti	5	\

15525	Harfield Guest Villa	26 1st Avenue	7700	Claremont	za	900040023	4.0	ZAR	770	1430		9	18.472347	-33.986392	88776	http://www.booking.com/hotel/za/harfield-guest-villa.html	http://aff.bstatic.com/images/hotel/org/949/949017.jpg	Situated in a quaint suburb of Cape Town, within walking distance of many attractions, this top quality bed and breakfast combines personalized service with a welcoming ambience.		Ubicado en un tranquilo barrio de Ciudad del Cabo, a poca distancia a pie de numerosos lugares de interés, este hotel de alta calidad combina un servicio personalizado con un acogedor ambiente.								claremont-za	Claremont	5	\

22949	Marine Square Luxury Holiday Suites	College Street	7200	Hermanus	za	-1236784	0.0	ZAR	990	2950		10	19.242703	-34.417009	59689	http://www.booking.com/hotel/za/marine-square-luxury-holiday-suites.html	http://aff.bstatic.com/images/hotel/org/125/1253957.jpg	Combining the benefits of a self-catering unit with those of a luxury hotel, these apartments are located in the heart of Hermanus - South Africa’s whale-watching capital.										hermanus	Hermanus	5	\

15536	HoneyPot B&B	11 Hilken Drive	4319	Umhlanga	za	-1294257	3.0	ZAR	650	1000		5	31.0617828369141	-29.7703377908281	43231	http://www.booking.com/hotel/za/honeypot-b-b.html	http://aff.bstatic.com/images/hotel/org/959/959331.gif	Situated in a quiet residential area of Umhlanga, only a short walk from the beach, this family-run guest house provides guests with an idyllic holiday getaway.	Située dans un quartier résidentiel d'Umhlanga, à deux pas de la plage, cette guest house de gestion familiale vous propose un endroit idyllique pour passer vos vacances.							这间家庭经营的旅馆位于Umhlanga的安静居民区,步行一会儿就能抵达海滩，为客人提供幽静的假日住宿。  Honey Pot B&B旅馆是您的另一个家，客房可以欣赏到迷人的景色和安静的花园。酒店距离热闹的村庄中心有600米，下设五间独立装饰的客房。清晨醒来的时候，您可以在室外泳池游泳或是计划海滩上的浪漫野餐。  酒吧区是理想的、享受清凉饮品和放松休息的好地方。您可以使用这里的商务设施及便携式烤肉设施。友好的员工乐于为您安排往返于酒店和机场间的班车服务及旅游活动。		umhlanga-rocks	Umhlanga	5	\

46628	Hobbit Boutique Hotel	19 President Steyn Ave	9301	Bloemfontein 	za	-1211814	4.0	ZAR	700	3000		12	26.2113534	-29.1056903	37559	http://www.booking.com/hotel/za/hobbit-boutique.html	http://aff.bstatic.com/images/hotel/org/185/1853875.jpg	Paying tribute to JRR Tolkien and his work, this boutique hotel is located near Bloemfontein’s centre and impresses with exquisite furnishings and a tranquil setting.										bloemfontein	Bloemfontein	5	\

23018	Schneider's Guest House	Warren Hill Close 6	1240	White River, Mpumalanga	za	-1302714	5.0	ZAR	1900	2700		6	30.9993410110474	-25.2893172510527	30007	http://www.booking.com/hotel/za/schneiders-guest-house.html	http://aff.bstatic.com/images/hotel/org/125/1256394.jpg	Luxurious accommodation awaits guests at this guest house, located in the town White River, just a short drive from Kruger National Park.  Overlooking the White River Golf Estate, Schneider’s Guest House combines natural colours with a modern design.			Von diesem Hotel in der Stadt White River mit seinen luxuriösen Suiten und Zimmern erreichen Sie innerhalb nur weniger Fahrminuten den Kruger-Nationalpark.			Esta hospedaria possui acomodações luxuosas, localizadas na cidade de White River, a uma curta distância de carro do Parque Nacional Kruger.				white-river	White River	5	\

15888	Ingwenya Lodge	163 Hornbill str	3936	St Lucia Estuary 	za	-1280384	0.0	ZAR	495	2000		6	32.412597	-28.383581	68005	http://www.booking.com/hotel/za/ingwenya-lodge.html	http://aff.bstatic.com/images/hotel/org/104/1043503.jpg	On the outskirts of the residential area of St Lucia, you’ll find the luxurious Ingwenya Lodge, nestled in the heart of the iSimangaliso Wetland Park.  The lodge itself has a sophisticated yet homely feeling to it.	Le luxueux Lodge Ingwenya, niché au cœur du parc iSimangaliso Wetland Park, se trouve aux abords du quartier résidentiel de St Lucia.  Le lodge en lui-même donne une impression de sophistication et de confort.			De luxe Ingwenya Lodge ligt aan de rand van het woongebied St Lucia, in het hart van het iSimangaliso Wetland Park.  De lodge biedt een verfijnde en toch huiselijke sfeer.					Na obrzeżach dzielnicy mieszkaniowej miasta Saint Lucia znajdą Państwo luksusowy hotel Ingwenya Lodge położony w samym sercu rezerwatu iSimangaliso Wetland Park.  Jest to elegancki, a zarazem przytulny hotel.	saint-lucia-estuary	Saint Lucia Estuary	5	\

15511	African Valley Estate	Farm 490/5 Helshoogte Road	7600	Stellenbosch	za	-1287082	4.0	ZAR	1080	1990		12	18.8995742797852	-33.9268033424139	58106	http://www.booking.com/hotel/za/african-valley-estate.html	http://aff.bstatic.com/images/hotel/org/945/945959.jpg	Ideally situated in the Simonsberg Mountain Range, just a stone’s throw from Stellenbosch, this luxurious hotel stands for excellent service and pure relaxation.		Este lujoso hotel goza de una ubicación ideal en la cordillera de Simonsberg, a pocos pasos de Stellenbosch. Ofrece un servicio excelente y una relajación total.   El African Valley Estate está a 40 minutos de Ciudad del Cabo.								stellenbosch	Stellenbosch	5	\

15417	Mondior at Emperors Palace	64 Jones Road 	1620	Kempton Park	za	-1243108	4.0	ZAR	1950	2505		150	28.2213234901428	-26.1440737567723	74423	http://www.booking.com/hotel/za/mondior-concorde.html	http://aff.bstatic.com/images/hotel/org/877/877917.jpg	Only a stone’s throw from Johannesburg International Airport, combining contemporary elegance with cutting-edge technology, this sizeable 3-star hotel sets new standards in world-class business and conference accommodation.	À deux pas de l'aéroport international de Johannesbourg, cet hôtel 3 étoiles de bonne taille combine élégance contemporaine et technologie de pointe et constitue une référence en matière d'hébergement d'affaires de classe mondiale.	A poca distancia del aeropuerto internacional de Johannesburgo, combinando la elegancia contemporánea con la última tecnología, este hotel de 3 estrellas cuenta con nuevas comodidades especiales para estancias de negocios.								kempton-park	Kempton Park	5	\

15117	Camps Bay Retreat & Spa	7 Chilworth Road	8040	Camps Bay, Cape Town	za	900040022	5.0	ZAR	2200	9740		16	18.3806401022198	-33.9466197338633	77517	http://www.booking.com/hotel/za/camps-bay-retreat.html	http://aff.bstatic.com/images/hotel/org/125/1259015.jpg	Tucked away on a large, private estate overlooking Camps Bay and the Atlantic Ocean, this retreat combines stunning views with first-class facilities.		Ubicado en una inmensa finca privada con vistas a Camps Bay y al Océano Atlántico, este refugio combina unas vistas impresionantes con unas instalaciones de primera clase.	Inmitten eines weitläufigen privaten Anwesens mit Blick auf Camps Bay und den Atlantik entspannen Sie in diesem Hotel vom Alltag. Freuen Sie sich auf eine beeindruckende Aussicht und eine erstklassige Ausstattung.			Abrigado numa grande propriedade privada com vista para Camps Bay e o Oceano Atlântico, este retiro combina vistas espectaculares com instalações de primeira classe.				camps-bay-za	Camps Bay	5	\

15216	The Westville Hotel	124 Jan Hofmeyr Road	3630	Westville	za	-1224926	3.0	ZAR	720	1000		22	30.930290222168	-29.8278282633115	50498	http://www.booking.com/hotel/za/the-westville.html	http://aff.bstatic.com/images/hotel/org/745/745689.jpg	With its suburban decor and style, this Durban hotel located in the leafy surrounds of the suburb is an attractive alternative to staying in the city.	Doté d'un décor raffiné, l'hôtel Durban est situé dans le cadre verdoyant de la périphérie, vous offrant une excellente alternative à un hébergement en ville.	Con un estilo y decoración característicos, este hotel en Durban se encuentra en la periferia de la ciudad y ofrece una atractiva alternativa al alojamiento en la propia ciudad.	Dieses geschmackvolle Hotel befindet sich in einem grünen Vorort und empfiehlt sich als attraktive Alternative zu einem Hotel in der Stadt.	Met zijn stadse decor en stijl is dit Durban-hotel, gelegen in de bladerrijke buitenwijk, een aantrekkelijk alternatief voor een verblijf in de stad.			郊外の装飾とスタイルを持つダーバンのホテルです。郊外の緑豊かな環境に立地する市内での魅力的な宿泊施設です。  全ての施設に近く、専用バスルーム付の客室が備わる快適な会議施設をお求めのお客様に最適なホテルです。静かで落ち着いたホテルには客室12室、レストラン2店、大きな会議施設が備わり、ビジネスでお越しのお客様に理想的です。  空港から20km、ダーバンの市内中心部からわずか10kmです。14km先には地域の魅力的なビーチがあります。	这家酒店位于Durban（德班）市郊绿树成荫的环境，拥有山村风格的装饰，为您在该市逗留提供了理想选择。  酒店拥有各种设施，如果您要寻求更休闲的会议场所和带连接浴室的住宿，酒店是一个理想的天堂。 这家安静、休闲的酒店拥有12间客房、2家餐厅和大型会议设施，非常适合企业用户。  酒店距离机场20公里，距离德班市中心仅10公里。 酒店距离该地区的迷人海滩只有14公里。		durban	Durban	5	\

15569	Cuningham's Island Guest House	cnr Kingsway & Church Square	6570	Knysna 	za	-1246436	3.0	ZAR	595	1400		7	23.062967	-34.067206	48614	http://www.booking.com/hotel/za/cuningham-s-island-guest-house.html	http://aff.bstatic.com/images/hotel/org/995/995533.jpg	Located on scenic Leisure Isle, close to Knysna's only beach - Bollard Bay, this guesthouse offers relaxed beach house living in combination with knowledgeable and friendly service.		Ubicado en Leisure Isle, cerca de la única playa de Knysna, Bollard Bay, este hotel ofrece un ambiente de casa de playa y un servicio agradable y profesional.								knysna	Knysna	5	\

19263	Halstead House Guest House	1 Halstead Lane	6170	Port Alfred	za	-1273436	4.0	ZAR	390	1500		8	26.897266	-33.590573	34538	http://www.booking.com/hotel/za/halstead-house-guest-house.html	http://aff.bstatic.com/images/hotel/org/120/1201614.jpg	Blending comfort and stylish designs, this turn-of-the-century homestead offers guests affordable accommodation in the heart of Port Alfred, and is situated within close proximity to the main beaches and restaurants.				Het Halstead House Guest House biedt een combinatie van comfort en een stijlvol interieur. Deze boerenhoeve van rond de eeuwwisseling biedt betaalbare accommodatie in het hart van Port Alfred.						port-alfred	Port Alfred	5	\

171308	Protea Hotel Franschhoek	33/34 Huguenot Road	494	Franschhoek	za	-1228880	4.0	ZAR	990	2425		30	19.1170373	-33.9067961	59079	http://www.booking.com/hotel/za/protea-franschhoek.html	http://aff.bstatic.com/images/hotel/org/184/1841817.jpg	Providing spacious, value-for-money accommodation, Protea Hotel Franschhoek overlooks the majestic mountains and famous vineyards of Franschhoek and is just a 10-minute walk from the town centre.				Protea Hotel Franschhoek biedt ruime accommodatie met een goede prijs-kwaliteitsverhouding. Het kijkt uit over de majestueuze bergen en de beroemde wijngaarden van Franschhoek en ligt op slechts 10 minuten lopen van het stadscentrum.						franschhoek	Franschhoek	5	\

